,movie_title,article_link,text
181,Jojo Rabbit,http://www.nytimes.com/2019/10/17/movies/jojo-rabbit-review.html,"According to a child psychologist cited in a recent article in The Atlantic, “little boys’ imaginary friends are frequently characters who are more competent than they are, such as superheroes or beings with powers.” That more or less describes the case of 10-year-old Johannes (Roman Griffin Davis), who has dreamed up a powerful pal to boost his confidence at anxious moments, always ready with a fist pump or a shout of “you got this!” Perfectly normal, and even kind of adorable, even though Johannes’s imaginary friend is Adolf Hitler. The make-believe Hitler is somehow both the most outlandish and the most realistic thing about “Jojo Rabbit,” Taika Waititi’s new film. Based on the novel “Caging Skies” by Christine Leunens — and featuring Waititi himself as Johannes’s goofball fantasy-Führer — the movie filters the banality and evil of the Third Reich through the consciousness of a smart, sensitive, basically ordinary German child. Veering from farce to sentimentality, infused throughout with the anarchic pop humanism Waititi has brought to projects as various as “Hunt for the Wilderpeople” and “Thor: Ragnarok,” it risks going wrong in a dozen different ways and manages to avoid at least half of them. Johannes, raised in a small town in Germany on a diet of propaganda and official Nazi youth culture, has turned Hitler into an emotional support figure, a confidant whose silliness is partly the mirror of the boy’s own insecurities. There are the serial humiliations of Hitler Youth day camp to contend with. Runty and timid, with halfhearted dreams of growing into an Aryan warrior, Johannes is bullied and teased. His nickname, Jojo Rabbit, isn’t meant affectionately. The buffoons who run the camp, an unhinged Valkyrie (Rebel Wilson) and a washed-out storm trooper (Sam Rockwell), are hardly ideal role models, and not only for the obvious ideological reasons. They are less terrifying than the ghoulish local Gestapo man, played by Stephen Merchant. Luckily, Johannes has a kindhearted mother, Rosie (Scarlett Johansson), who is immune to the seductions of National Socialism. (He also has a nonimaginary friend, Yorki, played by a scene-stealing young comic dynamo named Archie Yates.) The extent of Rosie’s opposition reveals itself slowly to Johannes and the viewer, whose point of view remains anchored in the bright colors and magical thinking of the child’s perspective. Still, we know more about what’s happening than he does, not only because we’re aware of the history he is living in, but also because we’re familiar with the contours of his type of coming-of-age story. At stake are Jojo’s innocence and his decency, and how one is purchased at the cost of the other. He needs to outgrow his selfishness and acquire the resources of empathy. Rosie can teach him a little, but his real education comes through his relationship with Elsa (Thomasin McKenzie), a Jewish teenage girl with artistic inclinations whom Rosie has hidden in a crawl space in their house. In Elsa’s presence Jojo is by turns resentful, afraid, infatuated and possessive. The tumult of his feelings, beautifully realized by the 11-year-old Davis, gives the film sweetness and charm as well as a sense of ethical urgency.  Sweetness and charm may not be the notes you want or expect in a movie about genocide and fascism, and there are times when the mood turns sticky and soft, straying a bit too close to the cloying kitsch of Roberto Benigni’s “Life Is Beautiful.” Waititi is trying for a tricky blend of tones, and “Jojo Rabbit” is sharpest when it dares to be funny. Laughter is inherently violent as well as potentially soothing, and the most farcical aspects of Jojo’s world are also the most terrifying. Without resorting to graphic imagery or replicating the sadism of its villains, the movie paints a credible, if unabashedly cartoonish, picture of the workings of an evil system. The particulars of the evil can seem curiously abstract, and the portrayal of goodness can feel a bit false, and forced. The outlandishness of anti-Semitism is emphasized — the idea that Jews have horns, for instance — to the exclusion of its less superstitious manifestations. And Elsa’s Jewishness has no real content. She exists mainly as a teaching moment for Johannes. Her plight is a chance for him to prove his bravery. This isn’t offensive, exactly — the spirit of the movie is too warm and the filmmaking intelligence too invigorating to provoke a strong objection — but it is a little disappointing. The humor is so audacious and the psychological insight at times so startling that it’s hard not to be dismayed when an easy and familiar dose of comfort is supplied at the end. This “Rabbit” is maybe just a little too cute, and a little too friendly. Jojo Rabbit Rated PG-13. Nazis. Running time: 1 hour 48 minutes."
182,The Lighthouse,http://www.nytimes.com/2019/10/16/movies/the-lighthouse-review.html,"Willem Dafoe and Robert Pattinson have two of the most mesmerizing — and pleasurably unnerving — physiognomies in movies. In “The Lighthouse,” a sly American Gothic set in the late 19th century, the director Robert Eggers lights and frames the actors to emphasize every bony plane, every facial crease, hollow and pinprick of stubble. The stark black-and-white cinematography deepens the film's shadows and unease, but it also throws these grizzled faces into relief, sharpening their cheekbones and revealing the death’s head under each man’s grimace. A horror movie about inner and outer darkness, the film begins with two lighthouse workers, Wake (Dafoe) and Winslow (Pattinson), arriving on a small, desolate island. Over many solitary days and nights, they work, eat, drink and dig at each other, establishing a bristling antagonism born of temperament and boredom or maybe just narrative convenience. Wake likes to yammer, but the men aren’t ready conversationalists. In time, their minds and tongues are loosened by alcohol and perhaps a simple human need for companionship. The wind howls, the camera prowls, the sea roars and Eggers flexes his estimable filmmaking technique as an air of mystery rapidly thickens. Much as he did in his shivery feature debut, “The Witch,” about an isolated family of fundamentalists coming unglued in early 17th-century America, Eggers makes the secluded world in “The Lighthouse” at once recognizable and eerily unfamiliar, a combination that draws you in but makes you feel unsettled. (He shares script credit with Max Eggers, his brother.) The image of the lighthouse evokes visions of high seas and storms as well as the promise of safe passage and harbor. But here, that romantic idea soon sours. Looming against the perennially gray sky this brick tower looks utilitarian and ominous, a twin to the 19th century’s industrial smokestacks. An old salt with alarmed hair and a wedge-shaped beard worthy of Melville, Wake is the veteran keeper of the lighthouse flame, the guardian of its traditions, language and superstitions. (Never ever kill a sea gull, he cautions.) Dafoe’s mercurial movements, his rippling face and spooky smiles, dovetail beautifully, articulating Wake’s moods and adding to the destabilization. He barks orders, sings a shanty, indulges in sentimentality and turns his yowling mouth into an abyss. To Winslow’s mounting irritation, Wake also guards the key to the lantern room, a glowing, near-mystical chamber with a magnificent prism that provides the film with blasts of bright light. With control and precision, expressionist lighting and an old-fashioned square film frame that adds to the claustrophobia, Eggers seamlessly blurs the lines between physical space and head space. The men in “The Lighthouse” don’t use the therapy-speak of contemporary American cinema (or life) with its endless overexplaining. Instead, Wake and Winslow come into focus through guttural exchanges, their physicality (farting, sweating, straining) and their built and natural environments. The sparse grass and rocky outcrops, the cramped rooms and vertiginous stairs speak to the men’s existential condition — the hardness, confinement and downward spiraling — while (as in “The Witch”) a menacing animal suggests a supernatural threat. Early on, Wake strips — as if to bathe in the lighthouse’s radiance  — and the story takes a turn for the amusingly perverse as trouble starts creeping around the edges. The men’s antagonism deepens as Wake jabbers and Winslow rages, a fury that Pattinson makes visible with eyes that widen into bulges and tremors of emotion that ping under a masklike vacancy. One man masturbates in a frenzy; at another point, he spies on the other grinding alone. The men’s sloppy, alcohol-saturated time together produces intimacy but also menace. They laugh, descending into riotous drunkenness and finding connection that both they and Eggers skitter around. The film itself doesn’t so much deepen as continue to glide on its seductive surfaces and teasing promise. “The Lighthouse” is largely without women. But their traces are strewn throughout, surfacing in the men’s anecdotes (their stories obscure as much as they reveal) and in a mermaid figurine that Winslow finds. He retrieves the crude statuette through a tear in his mattress, digging it out of the hairy stuffing with probing fingers that Eggers — who has the eye of a miniaturist — shows in close-up. (The scene evokes Harvey Keitel stroking a hole in Holly Hunter’s stocking in “The Piano,” another 19th-century Gothic tale.) For Winslow, the mermaid is a fetish, a replacement for something that remains elusive and that — as a flashback suggests — he can’t fully voice. The story in “The Lighthouse” is thin enough to invite plentiful interpretations about masculinity, homosocial relations and desire, even if its more suggestive theme is Wake’s punishing exploitation of Winslow. (It recalls Leslie Fiedler’s observation that “the proper subject” of the American Gothic is slavery.) The film’s more sustained pleasures, though, are its form and style, its presumptive influences (von Stroheim’s “Greed,” German Expressionism), the frowning curve of Winslow’s mustache, the whites of eyes rolled back in terror. Eggers meticulously sets the scene, adds texture and builds tension and mystery from men locked in battle and sometimes in embrace.  He has created a story about an age-old struggle, one that is most satisfyingly expressed in this film’s own tussle between genre and its deviations. The Lighthouse Rated R for nudity, salty language and violence toward animals. Running time: 1 hour 49 minutes."
183,Wounds,http://www.nytimes.com/2019/10/17/movies/wounds-review.html,"It starts with an innocent-looking cellphone in a yellow case with pink heart stickers. Innocent-looking. But that little device, which is the centerpiece of the movie “Wounds,” is more potent than you might imagine. The same is true of the giant, high-speed, Southern-style flying cockroaches that pervade this film, which begins streaming Friday on Hulu. If you’ve seen these monsters, you know to fear them the moment the first one appears, scuttling up a bottle at the New Orleans dive where Will (Armie Hammer) tends bar at night.  It is there, a bar called Rosie’s, that Will finds and pockets the phone, fished from among the shards of glass left after a brawl.  Some puzzling, even chilling texts pop in, and he feels compelled to answer. Then he is invited to see the “pretty pictures,” photos of dead bodies and worse. When his girlfriend, Carrie (Dakota Johnson), notices his absorption with the phone, he tries to explain it away.  But the more he sees, the more the normally affable Will suffers inside, his civility giving way to confused rage. Hammer maneuvers his character nimbly as Will skates on the edge of reality, lapsing into hallucinations or fugue states — or something more sinister. Carrie, a college student, gets drawn in, too, and not in a healthy way. The idea of the phone as a place where technology and the otherworldly meet attracts the researcher in her. Just bear in mind that Carrie is writing a paper on T.S. Eliot’s “The Hollow Men.” And “Wounds” begins with an epigraph from “Heart of Darkness” about a man who is “hollow at the core.”  When Will swaggers into Rosie’s by day, showing his boss (Rosie, of course) his increasingly uncontrolled fury, she asks, “What’s gotten into you?” What indeed. It’s regrettable that the writer-director Babak Anvari didn’t draw on the rich history of the occult in New Orleans to add texture to his film. Nor did he drench it in New Orleans music or local accents. There’s not even a single beignet (but there is a pool-playing naked woman at Rosie’s). “Wounds” was filmed on location, but we catch only glimpses of the city and scarcely feel the heat. It could be anywhere. Anywhere with extra-large roaches, that is. The lack of local color notwithstanding, the movie more than fulfills its promise to unsettle and to incite shivers — and it doesn’t quit. Wounds Rated R for gaping wounds, violence and brief nudity. Running time: 1 hour 34 minutes."
184,Black and Blue,http://www.nytimes.com/2019/10/24/movies/black-and-blue-review.html,"A supremely stressful day in Alicia West’s life — she will be shot at, betrayed and hunted by ruthless men on both sides of the law — begins with a morning jog through a quiet New Orleans neighborhood. Head down, earbuds in, minding her business, Alicia is stopped and frisked by police officers because she “fits the profile.” In other words, because she’s black. But when one of the patrolmen runs her identification, he tells his partner to let her go because “she’s blue,” i.e. one of their colleagues on the force. This is a blunt, efficient way for “Black and Blue” — a blunt, efficient thriller directed by Deon Taylor — to explain its title and its theme. Played by Naomie Harris with a quiet intensity that has room for notes of sorrow and confusion, Alicia is defined by an identity crisis that is hardly hers alone. For reasons that are partly temperamental and partly a matter of sheer bad timing, she’s caught up in an especially lethal set of contradictions involving her job and her race. Alicia, who has come home to New Orleans after combat duty in Afghanistan and the death of her mother, is a rookie and a bit of a loner, though she seems to have a decent rapport with her partner, Kevin (Reid Scott). Because of her job, people she grew up with treat her with coldness and suspicion, in particular her former best friend, Missy (Nafessa Williams). Milo (Tyrese Gibson), the manager of a grocery store, who goes by “Mouse,” is a little friendlier, but he also makes it clear that the line that separates them isn’t one he can comfortably cross. As the engine of its plot starts revving up, the movie takes in some of the realities of American life with matter-of-fact weariness. The scars of Katrina — and of the neglect and corruption that followed — are still evident, and the alienation of poor, black citizens is painful and profound. Alicia wants to believe something else is possible, that common ground exists, that people don’t have to be classified as “allies or enemies,” but this modest idealism only emphasizes her isolation. Rhetoric that once sounded hopeful and inspiring now sounds naïve. She’s hardly foolish or starry-eyed, but her desire not to succumb completely to cynicism means that no one else trusts her. It also endangers her life. How that comes about isn’t something I’m inclined to spoil, though it isn’t hard to figure out what’s going on or what’s coming next. Alicia stumbles on a bunch of dirty cops, led by a narcotics detective who goes by Malone (Frank Grillo), doing some terrible things, which happen to be captured by her body camera. Malone and his crew are mixed up with a drug gang (its leader is played by Mike Colter), and before long both groups are chasing her through alleys and housing projects. Rather than dress up its action with tricky, too-clever plot twists, “Black and Blue” respects both Alicia’s and the viewer’s intelligence. It doesn’t take too long to figure out who the bad guys are, or to see where the next bit of treachery will come from. Alicia and the reluctant Mouse are caught up in a conspiracy so vast and deeply rooted that it seems like part of the city’s infrastructure. That’s a depressing thought, and Alicia is an apt heroine for a time of dread, disappointment and diminished expectations. I don’t mean to make the movie sound altogether grim. Taylor is good at choreographing violence and orchestrating suspense, and also at finding the grain of humor in each performance. He showed all of these skills earlier this year in “The Intruder,” a real-estate thriller that flirted with some of the social implications that “Black and Blue” commits to without reservation. The politics here are elemental and undeniable without being preachy or pretentious. There are one or two soapbox moments, including a self-justifying speech by the principal villain, that could have been left out, but to say as much is really just to note how tight and coherent the movie otherwise succeeds in being.  Sometimes genre entertainment can illuminate troubling realities better than more earnest and self-seriously realistic films, and “Black and Blue” belongs to that tradition. Its pulpy pop-cultural credibility is inseparable from its honest, brutal assessment of the state of the world. Its ideas about the nature and limits of heroism — about just how hard and terrifying the resistance to evil can be — are spelled out in vivid black and white. Black and Blue Rated R for swearing and shooting. Running time: 1 hour 48 minutes."
185,The Current War,http://www.nytimes.com/2019/10/24/movies/the-current-war-review.html,"A bucket of Oscar bait that’s been sitting around for some two years, “The Current War” may still find an audience. And it should: The film certainly doesn’t reek of failure. But as its energetic early scenes give way to a sluggish second half, you start to sense how much better this good-enough movie might have been.  Beginning in 1880, the story centers on the rivalry between Thomas Edison (Benedict Cumberbatch) and George Westinghouse (Michael Shannon) as they race to wire American cities for electricity. Edison is a proponent of direct current, while Westinghouse pushes alternating current. (Even if you have trouble plugging in a toaster, don’t worry: Alfonso Gomez-Rejon, the film’s director, makes their conflict clear enough, using sweeping music and sharp camera angles to tell us how to feel.)  Side stories abound. We meet Nikola Tesla (Nicholas Hoult, underused, as is Katherine Waterston as Westinghouse’s wife, Marguerite), J.P. Morgan (Matthew Macfadyen) and Samuel Insull (Tom Holland), Edison’s personal secretary. They and other famous figures pop in and out as Michael Mitnick’s script moves to its finale, where the two adversaries arrive at the 1893 Chicago World’s Fair. If the plot doesn’t always pulse with excitement, the rest of the biopic screams prestige project: sumptuous sets and handsome costumes fill this period piece. There are also a few smart parallels to today’s celebrity entrepreneurs, and to a world undergoing rapid technological change. The film was scheduled for release in late 2017 by the Weinstein Company. After accusations of sexual assault by Harvey Weinstein led to his company’s bankruptcy, the movie was sold to another studio. There were reshoots and re-edits, and additional delays. The film is now being released with the subtitle “Director’s Cut” to distinguish it from the version that premiered at the Toronto Film Festival in 2017 under Weinstein’s hand.  Cumberbatch cleverly embodies the ambitious Edison, who’s not above sacrificing a few pesky morals for success, nor using his fame to manipulate the media. (A scene where he first lights up a section of Manhattan is beautifully bold.) Shannon is restrained yet charismatic in a role that could have easily been overplayed. For sure, everyone here is fun to watch, making it all the more irksome when, perhaps a half-hour before the end, the film runs short of things to say. The Current War: Director’s Cut Rated PG-13. Running time: 1 hour 47 minutes."
187,The Kill Team,http://www.nytimes.com/2019/10/24/movies/the-kill-team-review.html,"In “The Kill Team,” the director Dan Krauss has made a dramatized version of his 2014 documentary of the same title; it explores the same events from a different angle, but with less impact. Both movies concern a case from about a decade ago in which five American soldiers were accused of murdering Afghan civilians. Calvin Gibbs, the staff sergeant whom the documentary presents as a driving force behind the killings, received a life sentence. The principal point of the earlier film was that a specialist, Adam C. Winfield, who received a three-year sentence after pleading guilty to manslaughter deserved more lenient treatment because he had tried to blow the whistle on his fellow soldiers. When your comrades are committing murders in a war zone, the documentary argued — letting Winfield off the hook too easily — not going along with them means risking getting killed yourself. More of a companion piece than a substitute, the fictionalized version (names have been changed) tries to show the pressure mounting on a soldier called Andrew Briggman (Nat Wolff), as he is intimidated by a bloodthirsty new sergeant, Deeks (Alexander Skarsgard). Deeks enthralls his men with the promise of making each one “a warrior.” He enforces a rigid code of silence, undercutting Briggman’s self-esteem and turning the men against one another. This present-tense perspective is useful, but while the leads are credible, the filmmaking (including a hacky score) adds a sheen of macho familiarity to a narrative that was eerily matter-of-fact in doc form. Dramatizing these events makes them seem isolated — a bad-apples incident. The documentary had a more haunting implication: If you train soldiers for Hollywood-ready combat, violence on peacekeeping missions becomes inevitable. The Kill Team Rated R for murder and gruesome trophies from killings. Running time: 1 hour 27 minutes."
188,The Gallows Act II,http://www.nytimes.com/2019/10/24/movies/the-gallows-act-two-review.html,"Contemporary horror films, often ruthless in their eagerness to deliver the ostensible scary goods, frequently decline to adhere to their own internal logic. “The Gallows Act II,” a thoroughly undistinguished follow-up to the 2015 film “The Gallows,” seems, for much of its running time, not to have any internal logic to begin with. After a found-footage-style prelude establishing the telekinetic, or whatever it is, power of the play-that-kills called “The Gallows,” the movie, written and directed, as the first one was, by Chris Lofing and Travis Cluff, brings us into a fresh world of high-school drama. The eager aspiring actress Auna (Ema Horvath, who has a touch of young Hilary Swank) moves in with her older sister to attend a new high school with a stellar drama department. Auna is pointed to the cursed play by an anonymous subscriber to her YouTube channel. Her discovery of it leads her to some inspired monologuing — being semi-possessed by supernatural evil makes you a better actor, everybody knows that — as well as some scary new videos in which bedroom objects fly around and a masked hangman inexplicably turns up in the background. After which it’s 80 minutes or so of rhyme-and-reason-free gotcha’s, augmented by the bland presence of Auna’s impossibly square-jawed new beau, Cade (Chris Milligan). The movie’s finale offers a twist that ostensibly ameliorates the internal-logic complaints. But it most vividly registers as a rancid misogynist cherry atop a sloppy concoction of tired jump scares. The Gallows Act II Rated R for themes, violence, tired jump scares. Running time: 1 hour 39 minutes."
