,movie_title,article_link,text
66,Avengers: Endgame,http://www.nytimes.com/2019/04/23/movies/avengers-endgame-review.html,"“No amount of money ever bought a second of time,” one character says to another — I’m afraid I can’t be any more specific than that — somewhere around the middle of “Avengers: Endgame.” So true, so true, and also in context so completely not true. The intersecting axes of time and money are what this franchise is all about, and while I’m not an expert in studio math, I’d guess that a second of the movie, based on what Disney and Marvel Studios paid to make it, would buy a decent used car. There are roughly 10,860 of those — seconds, not cars — nestled in between the quiet, spooky opening and the last bit of end credits. Which means that whatever a ticket costs in your neighborhood, “Avengers: Endgame” might count as a bargain. At three hours and one minute, it’s shorter than “Titanic,” “The Godfather Part II” or Luchino Visconti’s “The Leopard.” And while the time doesn’t exactly fly, it doesn’t drag either. The two hours and forty minutes of “Infinity War” (also directed by Joe and Anthony Russo) felt infinitely longer. Settling scores, wrapping up loose ends and taking a victory lap — the main objects of the game this ostensibly last time around — generate some comic sparks as well as a few honest tears. And why not? We’ve lived with these characters and the actors playing them for more than a decade, and even when the party got hectic, stupid or crowded, there was no reason to complain about the guests. For the most part, it’s nice to see them again, and a little sad to say goodbye. [Read the screenwriters’ explanations for plot points. | What to read if you want more Avengers. | How the movie did in Week 2 at the box office.] Chris Hemsworth’s Thor, always kind of neurotic for a buff deity with a mighty hammer, has let himself go, turning into a fat Lebowski with mommy issues. War Machine (Don Cheadle), Black Widow (Scarlett Johansson) and Hawkeye (Jeremy Renner) have more to do than previously. (I wish that were also true of Tessa Thompson’s Valkyrie.) The Hulk (Mark Ruffalo) has made peace with his essential duality. Robert Downey Jr., looking handsomely grizzled, exercises his seniority with a light touch. He’s been around the longest — the first “Iron Man” was in 2008 — and combines the duties of unofficial chief superhero with those of master of ceremonies. It’s not all fun and games. A lot of heroes died at the end of “Infinity War,” and their loss weighs heavily on the survivors, perhaps especially on Nebula (Karen Gillan), whose father was responsible for the slaughter. Thanos’s deployment of the six Infinity Stones to wipe out half the life in the universe was unforgivable, of course — I can’t believe I just typed that — but it proves to have been helpful to the Russos, the screenwriters (Christopher Markus and Stephen McFeely) and the audience. We and they have a manageable dozen or so major characters to keep track of, which leaves room for some of the alternately lump-in-throat, tongue-in-cheek ensemble work that has always been the series’s most potent weapon. “The Avengers” cycle may require an escalating series of battles to save the universe from ultimate evil — each manifestation more ultimate than the last, with Thanos (Josh Brolin) as the ultimate ultimate of them all — but the engine that keeps it running is friendship. This isn’t the same as harmony. Going back to the earlier movies, Hulk and Thor have had their moments of friction, as have Iron Man and Captain America (Chris Evans). The personal and political bad blood between those two, most acute in “Captain America: Civil War,” continues to simmer, at least at first. But the mood over all is tender and comradely, touched by acute grief and the more subtle melancholy of what everyone seems to understand is the Last Big Adventure. About that adventure, I won’t say much, though it strikes me that the shape of the plot is less vulnerable to spoilage than the little winks and local surprises along the way. [Everything you need to know before “Endgame,” in two minutes] Those are the rewards for sitting through all those movies patiently waiting for the post-credit stingers, collecting Easter eggs while your friends were texting or your dad was napping and generally doing the unpaid labor of fandom for all these years. Was it worth it? In the aggregate, I have my doubts, but the chuckles and awws you’ll hear around you in the theater at certain moments attest to the happy sense of participation that lies at the heart of the modern fan experience. At its best — and “Endgame” is in some ways as good as it gets — the “Avengers” cosmos has been an expansive and inclusive place. That has proved to be good business. Disney and Marvel’s accomplishment will be duly inscribed in the annals of commerce, to be studied for many years to come. There has been variety — silly movies and somber ones; chapters that proclaim their topicality and episodes that embrace pure escapism — as well as consistency. Any single film can serve as a point of entry, and insider status is easy enough to obtain. There has never been anything difficult or challenging, which is a limitation as well as a selling point. None of the 22 films in this cycle are likely to be remembered as great works of cinema, because none have really tried. It’s fun to see the actors in these roles we know are capable of better, and also satisfying to appreciate the efforts of those who might not be. Some first-rate directors have taken up the banner and burnished the brand. Their past and future masterpieces will most likely be found elsewhere. Still, “Endgame” is a monument to adequacy, a fitting capstone to an enterprise that figured out how to be good enough for enough people enough of the time. Not that it’s really over, of course: Disney and Marvel are still working out new wrinkles in the time-money continuum. But the Russos do provide the sense of an ending, a chance to appreciate what has been done before the timelines reset and we all get back to work. The story, which involves time travel, allows for some greatest-hits nostalgic flourishes, and the denouement is like the encore at the big concert when all the musicians come out and link arms and sing something like “Will the Circle Be Unbroken.” You didn’t think it would get to you, but it does."
67,I Trapped the Devil,http://www.nytimes.com/2019/04/25/movies/i-trapped-the-devil-review.html,"A couple find themselves caught in a Christmas nightmare in “I Trapped the Devil,” the promising horror debut by Josh Lobo. When Matt (AJ Bowen) and his wife, Karen (Susan Burke), visit his long-estranged brother Steve (Scott Poythress) for the holidays, they are unnerved by his reclusiveness and boarded-up windows. Their anxiety tips to panic when they hear the voice of a man begging to be released from behind a locked door in the basement. Steve claims the man is the devil himself, leaving his family caught between two possible monsters: either a demon downstairs or a madman upstairs. This is a stylish film, a single-set thriller that uses color, framing and sound to draw out the dread of captivity. The basement glows with diabolical scarlets, and Steve’s hostage speaks with a surprisingly soft voice that reverberates as if his vocal cords were made of metal. These flashes of hyperstylization enthrall, but Lobo does not extend this flair to his characters. They face down the gates of hell in ratty button-downs and jeans, their faces slipping away even when they aren’t shrouded in cellar shadows. Many horror films are built around the conceit of naïve, ordinary people caught in unimaginable circumstances. But great horror movies — including those that Lobo’s film recalls, like Bob Clark’s 1974 classic “Black Christmas” — find ways to make characters a part of the visual experience, using costume design, casting and more to raise simple archetypes to mythic proportions. By seesawing between bland normalcy and hellishness, Lobo denies his audience the immersive horror that his film’s best images promise."
70,Long Shot,http://www.nytimes.com/2019/05/02/movies/long-shot-review.html,"“Long Shot” isn’t going to save the romantic comedy, but it’s an adrenaline shot of pure pleasure to the genre’s failing heart. The outline is familiar: Two people meet, retreat and then circle each other, all while talking and talking. The romantic comedy turns on people who fit together — in bed, on the dance floor — but also talk to each other, exchanging words that stop flowing and faltering only with a culminating kiss and teasing fade-out. The difference here is that unlike a lot of romances, the woman retains her power and identity, and that’s how the movie likes it. In “Long Shot,” Charlotte Field (Charlize Theron), the secretary of state of the United States, and Fred Flarsky (Seth Rogen), a struggling journalist, talk a lot. They connect while attending a charity event — Boyz II Men is crooning onstage — spotting each other across a crowded room. It’s a classic meet cute, in the parlance of the romantic comedy, but with a twist. Charlotte used to babysit Fred (she’s a few years older), a fact that still looms large in his memory. They haven’t seen each other since, but when they meet again they quickly spark, lighting a long fuse that winds through the story as nostalgia turns into something sweeter and then heavier. It’s preposterous: She’s a giant, a goddess and he’s … Seth Rogen. It doesn’t bode well that the movie initially seems more interested in Fred than in Charlotte, an apparent imbalance that suggests this will be another weak chuckle-fest in which the female lead is a convenience or decoration, on hand mainly to vouch for her guy’s heterosexuality. The opener, though — with Fred undercover in a roomful of neo-Nazis — proves tactical. It sets a strangely uneasy mood for a comedy, one that’s funny ha-ha but also unsettling. More to the story’s point, it also places Fred in the most toxic of man caves imaginable: a homosocial world of booze-chugging, chest-thumping, sieg-heiling bros. Of course Fred escapes — taunting the enemy, he briefly turns into a self-proclaimed Jewish superhero — and his adventure is folded into a subplot. It’s a shrewd introduction, one that establishes Fred’s ethical principles and willingness to take risks; it also gives him an early, crucial triumph. Just as important, it offers a semi-comic glimpse at a culture that fetishizes manliness and devalues women. When Fred flees, he breaks away from baddies but also from the ultimate in masculinity cults. It’s in keeping with a character who may have a best dude on speed dial (the amusing O’Shea Jackson Jr.) yet doesn’t suffer from the usual movie male maladies, including fear of women. Charlotte soon enters, effortlessly dominating every scene and room while juggling and suffering assorted fools, including the president of the United States (Bob Odenkirk in peerless form). Theron, a natural screen presence who has developed into an undeniable one, is wonderful in “Long Shot.” She’s a fascinating performer with a watchfulness that can make her seem detached. She seems supremely and confidently alone onscreen, which in moments can create an internal tension with her physical superfluidity, her outward, inviting flow. It’s an ideal combination for this character who never breaks stride as she agilely evades obstacles, most of which are men (Andy Serkis, Alexander Skarsgard). “Long Shot” humorously skitters over these and other hurdles, including the imperative that powerful single women must have men by their side, mostly to make everyone feel comfortable with all that female power. That’s a tricky idea for any romantic comedy to take on, one that “Long Shot” doesn’t solve but instead slides over after Charlotte hires Fred as a speechwriter. Much of what happens isn’t surprising, but Dan Sterling and Liz Hannah’s script is consistently, genially funny, filled with patter and nonsense, and spiked with sincerity and a few gross-out flourishes. And while the director, Jonathan Levine, doesn’t do much visually, he pulls off the occasional, well-timed sight gags and often puts Charlotte and Fred in the same shot — they even share the frame — rather than loading up on the usual TV-friendly close-ups of single heads. Movies have long segregated men and women by genre, but at some point we seemed to enter a new age of his-or-her cinema. Straight men and women went their separate, generally unequal ways and stopped talking, really talking, to each other in movies. Men retreated into buddy pictures à la Butch and Sundance or swooned into bromances; for their part, women prepped for weddings that felt like battles or indulged in a hangover-inducing hurrah. The romantic comedies in which men and women hook up have often been excruciating (“The Ugly Truth,” “The Proposal”), fueled by sexist stereotypes and gender policing that suggested women’s lib had given Hollywood a permanent headache. Yet we just can’t quit romantic comedy, even if contemporary American movies as a whole are more comfortable making war than peace, much less love. The reasons are cultural, social and industrial, at once obvious and obscure. One problem is the current business model in which big studios pour tremendous resources into globally salable male-driven blockbusters. The other problem is the industry’s deep-seated, long-maintained fear of female power. In a business long defined by aesthetic and economic conservatism, and that has a bad habit of selling the same stories, women — including those who are sexually desirable, desiring and sovereign — remain a puzzle and a threat. It’s no wonder that after decades of putting women in rigidly circumscribed roles the industry has had a tough time figuring out what to do with them. If things have started to shift it’s partly because heroines like Katniss Everdeen and creators like Amy Schumer are helping redefine the female lead. Like Mindy Kaling and other funny women, Schumer is doing it with laughs and stumbles, but also with an earnestness that affirms something real is at stake: love, hearts and maybe, possibly, a gender-fluid happily ever after. “Long Shot” mostly just toys with some of these ideas; it’s awfully straight, in all senses. But it doesn’t just put a woman on top, it also leaves her there, blissfully."
71,The Intruder,http://www.nytimes.com/2019/05/02/movies/the-intruder-review.html,"“The Intruder,” a real-estate-based thriller set in California’s Napa Valley, is more silly than scary. This doesn’t seem to be entirely intentional, and it isn’t altogether unwelcome. The idea of Dennis Quaid popping up in your kitchen in the middle of the night might not exactly be the stuff of nightmares. Quaid, playing a deranged ex-homeowner named Charlie Peck, seems to know this. And the director, Deon Taylor, does too. Still, there are a few jolts and a heavy dose of caveat emptor. The emptors are Scott and Annie Howard, a couple from San Francisco who buy Foxglove, a rambling ivy-covered pile that has been in Charlie’s family for generations. Annie (Meagan Good), a writer for women’s magazines, falls in love with the house. Scott (Michael Ealy), a big-shot marketing strategist, isn’t so sure, but an isolated house at the end of a spooky, tree-lined driveway seems like the perfect place to start a family. Charlie couldn’t be more obliging. He shows up to mow the grass, brings pies for Thanksgiving dinner and helps Annie hang Christmas lights. It takes her a comically long time to detect the creepiness in his attentions, given the twitchy, eyeball-rattling derangement that Quaid brings even to Charlie’s quieter moments. Scott figures out what’s going on a little faster, but behaves like enough of a jerk to make Charlie look sympathetic. Eventually things move from creepy to murdery, as everyone in the audience always knew they would. There isn’t a lot going on here. Annie and Scott have exactly two friends (Joseph Sikora and Alvina August), no family to speak of and not much to talk about. There’s a hint of domestic trouble in their background, and a tragedy in Charlie’s that turns out to be something much worse. But David Loughery’s functional script doesn’t spend much time exploring motives or psychological nuances. Scott needs to defend his wife and his property, both of which Charlie regards as rightfully belonging to him. Charlie is white. Scott and Annie are black. Nobody in the film makes the slightest reference to race, which has the effect of turning it into a subtext — an undropped shoe in a room full of people pretending to walk around barefoot. In much the same way that it’s not about race, “The Intruder” is not about politics, which is to say that there’s a suggestive little allegory tucked into its by-the-numbers plot. Charlie is a guy with a lot of guns who favors red baseball caps. He may have sold his house to the Howards, but he doesn’t quite accept that it’s theirs. When they replace a piece of art on the living room wall with something more to their taste, he’s nearly apoplectic with rage. He wants to take the place back and make it great again, even though it emerges that he messed everything up in the first place, including his marriage and his business. He just can’t accept change, and he’d rather destroy the house than let someone new live in it. Like I said: more silly than scary. Unless it’s the other way around."
72,UglyDolls,http://www.nytimes.com/2019/05/01/movies/uglydolls-review.html,"Adults who regularly buy children’s gifts will recognize the denizens of the movie “UglyDolls,” the plush toys of the same name. Milder in design than old-school troll dolls, these figures have a message: Idiosyncrasies of appearance and personality are not “ugly,” but rather emblems of awesome individuality. The relentless positivity of this fable is put across with such bounce-house energy that children in the audience may be bludgeoned into submission instantly. (It made this adult’s teeth hurt.) Here, Moxy, the most cheerful doll in Uglyville, wakes each morning just knowing there’s a child for her in “the big world.” Moxy and some of her misfit pals set out to find said big world, only to be obstructed by the Institute of Perfection, a land of pretty dolls presided over by a pert-nosed, golden-haired paragon, creatively named Lou. He and some mean-girl dolls in his thrall will stop at nothing to thwart Moxy and her dream. These characters are voiced by some of the most prominent names in pop music: Kelly Clarkson, Janelle Monáe, Blake Shelton, Charli XCX, Pitbull and Nick Jonas, to name but a few. Comic talents such as Wanda Sykes and Gabriel Iglesias also feature. Yet every aspect of this computer-animated movie directed by Kelly Asbury seems equally overdetermined and tossed-off, as if it were a caffeinated weekend project for everyone involved. The neon colors bring to mind what a “Candy Crush” movie might look like, while the never-ending songs are cute, flavorless paeans to self-love. Individual scenes evoking “The Lego Movie” and “Toy Story 3” feel like lifts rather than homages, and are blatant to the extent that your older kids might even notice."
73,Extremely Wicked,http://www.nytimes.com/2019/05/02/movies/extremely-wicked-shockingly-evil-and-vile-review.html,"Leaning into his hotness with surprising dexterity, Zac Efron plays the notoriously charming serial killer Ted Bundy like someone who has always understood how to weaponize a pretty face. So the problem with the biopic “Extremely Wicked, Shockingly Evil and Vile” isn’t Efron (or that cumbersome title), but his director, Joe Berlinger. Working ostensibly from the viewpoint of Bundy’s longtime girlfriend, Liz Kendall (an excellent Lily Collins), Berlinger never fully commits. Instead, he appears as seduced by Bundy as virtually everyone else in the movie. Only animals, the film suggests, can resist the killer’s allure, as we watch a whimpering dog back away when Bundy and Liz visit the pound. Even the judge in his televised 1979 murder trial (played, delightfully, by John Malkovich) seems as spellbound as the gallery filled with fluttering young women. “Bless your heart,” he remarks to the showboating defendant, complimenting his legal skills and passively tolerating Bundy’s impromptu marriage proposal to one of the witnesses. Scenes like these strike an unfortunate comedic note that undercuts the seriousness of Berlinger’s point: that devils may come disguised as angels. In documentaries like his stunning “Paradise Lost” trilogy, he has repeatedly interrogated our flawed ability to accurately identify monsters, chipping away at our biases to expose their fragility. Yet while Bundy’s well-documented charisma is on full blast here, we only fleetingly feel its chill. And by leaving most of his heinous acts off screen, Berlinger (who also has a Bundy documentary, “Conversations With a Killer,” on Netflix) is apparently relying on unwitting audiences being as devastated by his guilt as poor Liz. All this makes for a very odd picture, one that purports to care about the women Bundy duped — including Carole Ann Boone (Kaya Scodelario), who married him and had his daughter — while simultaneously marveling at their gullibility. Efron’s smoothly manipulative performance makes a mockery of their devotion, so much so that at times the movie appears less about the psychology of a specific sociopath than a general comment on women who shield such men and even hanker after them. This longing to touch the flame and tame the dragon could have made for a fascinating thread in the familiar serial-killer narrative, but “Extremely Wicked” (the title comes from the judge’s characterization of Bundy’s crimes) is too unfocused and lacking in imagination to pick it up. Early scenes detailing Liz and Bundy’s 1969 meeting and happy homemaking with her small daughter are followed by years of arrests, escapes and multistate charges for his still-unseen crimes. The final third leaves Liz to her drinking and depression as the movie transforms into a courtroom procedural and a showcase for Bundy’s strutting self-confidence. Blurring documentary and drama with the overused tic of playing real-life footage over the end credits, Berlinger still leaves Bundy no more than a slick enigma. It’s the same problem that dogged the director’s excessively flattering 2016 portrait of the motivational speaker Tony Robbins: at a certain point, we realize that Berlinger might simply be unable or unwilling to look beyond the dazzle."
74,Pokémon Detective Pikachu,http://www.nytimes.com/2019/05/09/movies/pokemon-detective-pikachu-review.html,"“Pokémon Detective Pikachu” is the first feature to pivot on a pairing of animated characters from the Japanese merchandising juggernaut and real live actors. But why even bother? The human stars barely look like they have pulses. The plotting proceeds with the one-mission-then-the-next logic of a video game, and even the notion of film noir feels bogus. When we see a clip from a gangster picture on screen, it’s the fake movie from “Home Alone.” A video game is, in fact, what “Detective Pikachu,” directed by Rob Letterman, is based on, but its sense of cinematic history extends at least to the long-long-ago of 1988 and “Who Framed Roger Rabbit,” to which it owes what might be called a debt. Tim (Justice Smith) has a deep-seated dislike for Pokémon creatures, just as Bob Hoskins’s private eye did for ’toons in “Roger Rabbit.” That aversion is tested when he teams up with Pikachu (voiced by Ryan Reynolds), his father’s detecting partner, after the father appears to have been killed in an accident. (Pikachu became a gumshoe for Nintendo, but the character, as seen in other Pokémon adventures, is the cute little critter with rosy cheeks who causes storms of electricity.) [When Pokemon go 3-D.] Detective Pikachu has amnesia, though. As if inviting the viewer to pick up a controller, he laments aloud that he can’t solve his own mystery. He can, however, talk to Tim — everyone else simply hears “pika, pika” — in dialogue that sounds like Raymond Chandler filtered through the children’s game of telephone. Their stomping ground, Ryme City, incorporates elements of London, Tokyo and New York but makes them all look like their theme-park equivalents. The town is half paradise and half dystopia: Humans and Pokémon live side by side, even while gamblers egg on vicious Pokémon battles in the city’s underworld and an unpaid journalism intern (Kathryn Newton), sick of listicles, snoops around for a story. (O.K., maybe that last part feels real.) The narrative seems designed to be followed by even those with the shortest attention spans; plot points get repeated in case you’ve decided to look down to send a text message. (“That must have been how Mewtwo escaped,” Tim says of the movie’s menacing catlike villain — right after a hologram has shown us that very escape.) “Pokémon Detective Pikachu” has been shot on film, a nostalgic touch that’s now unusual for a movie that combines live action and cartoons. But the imagery lacks weight and texture. (Anyone who dismissed the technical mastery Steven Spielberg brought to “Ready Player One,” a similar combination of real and virtual worlds, ought to feel pretty sorry now.) This is 1 hour and 44 minutes of Pikachu short-circuiting your brain."
