,movie_title,article_link,text
122,Fast & Furious Presents: Hobbs & Shaw,http://www.nytimes.com/2019/08/01/movies/fast-and-furious-presents-hobbs-and-shaw-review.html,"The people who made “Fast & Furious Presents: Hobbs & Shaw” know that Dwayne Johnson (Luke Hobbs) and Jason Statham (Deckard Shaw) have an easy adversarial chemistry. They build the movie around their put-downs and pranks. Statham stays focused on how Johnson’s size makes him seem kind of dumb and unsubtle. And Johnson picks on what an indecipherably British hobbit Statham is. At some point, Hobbs gets a load of Shaw’s stable of sports cars and asks if he’s, uh, overcompensating. Seems right for two people — an American agent and an English mercenary — who spent an exciting sequence at the top of the seventh “Fast & Furious” movie throwing each other through glass windows and designer office furniture. This spinoff is more of the same. But, written by Chris Morgan, who’s handled most of the “Fast & Furious” movies, and Drew Pearce, it weighs less and seems to know that, too. David Leitch directed it, and the fights and chases achieve a kind of smooth brutality that makes sense for the maker of “Atomic Blonde” and the second “Deadpool” and who had a hand in the first “John Wick.” It has a good hip-hop soundtrack and the sort of coherent editing that you need for something with this much juxtaposed bone-breaking. The weightlessness, however, extends to a plot that makes no sense, and involves an extinction-level virus that Shaw’s intelligence-agent sister, Hattie (Vanessa Kirby), has heroically injected into herself and that doesn’t at all diminish her agility, wit or capacity for flirtation. The filmmakers so want to maintain the joshing between Johnson and Statham that the movie’s ostensible action label and the lust Shaw fears Hobbs has for his sister feel like pretexts for the romantic comedy “Hobbs & Shaw” virtually is.  Idris Elba plays the movie’s biomechanically enhanced supervillain, and not that far into things, he wonders aloud who’s going to stop him. So, for an answer, there’s a cut to a split screen of Johnson and Statham in their respective beds. Each is going about his day — waking up, eating, exercising, taking phone calls simultaneously with the exact same response. “Jinx!” I thought to myself. With the screen split, their bald heads — Johnson’s is smooth, Statham’s stubbled — are often inches from each other. And over the course of the movie, the tension between these two has so escalated amid the downpour of virility that by the time they’re on a plane arguing, again, over the sister (“I’m gonna let her climb this mountain. Over. And over”) those bald heads are all but knocking into each other. I was torn. Was the right response, “Get a room” or “Here’s a scrotum”? It’s serious enough between them that anytime the movie presents alternative partnerships in the form of cameos by other, more naturally funny male stars, Hobbs and Shaw decline. This relationship is closed! And that gives a ridiculous sensuality to the climactic three-way beat-down and the way the frame speed decelerates enough for every punched face and kicked head to seem like a caress, as if they were Demi Moore and Patrick Swayze at her pottery wheel in “Ghost.” None of that makes “Hobbs & Shaw” better. It doesn’t save the movie from a saggy setup for the showdown, in Samoa, between Elba’s anonymous paramilitary goons and Hobbs’s mostly anonymous Samoan family.  Estrangement is the movie’s big theme — Shaw hasn’t seen his sister in ages, and Hobbs swore he’d never go back to that island (meaning his smart 9-year-old daughter has never met her formidable grandmother). The movie doesn’t care about the strains in these relationships, so why strain them? Nothing changes if Hobbs and his brother (Cliff Curtis) are on good speaking terms. They’d still assemble dozens of their siblings and cousins for the finale’s assorted phases. They’d still figure out how to affix a bunch of trucks to a flying chopper. It’s just more pretext. The whole thing just makes me miss how horny and violent movies used to be. Here, all the violence is sex. Only, it’s not. It’s just winking. That chastity is a quiet lament in the buddy movie likely to be playing across the hall from this one, Quentin Tarantino’s “Once Upon a Time … in Hollywood.”  That film has a lot to mourn, including the idea that sex has gone out of the movies. At some point, Tarantino shows us a coming attraction for Joe Namath and Ann-Margret in “C.C. and Company,” a loud, dumb, fun motorcycle romp from 1970 in which all Namath does is tussle, drive and, with her, fool around. A movie like that portended 20 years of action-thrillers that also had a libido. The women didn’t always fare well, but nobody feared sex. That was as omnipresent as smoking and guns.  We don’t believe in the sex anymore. All we’ve got now is the guns. When “Hobbs & Shaw” whisks everybody to a Moscow mansion stocked with sexy thieves and Shaw walks in and plants one right on the ringleader (Eiza González), Hobbs and the sister look on in horror. We’re grossed out, too. He is overcompensating. Fast & Furious Presents: Hobbs & Shaw Rated PG-13. Kicking, shooting and punching — but the harmless, bloodless cartoon kind. Running time: 2 hours 15 minutes. "
123,A Score to Settle,http://www.nytimes.com/2019/08/01/movies/a-score-to-settle-review.html,"Nicolas Cage’s singing voice might not be the worst thing about the revenge thriller “A Score to Settle,” but it’s right up there with Clint Eastwood’s woodland warblings in “Paint Your Wagon” (1969). I could happily have gone to the grave without hearing either. Which is exactly where Frank Carver (Cage), the onetime enforcer for an Oregon crime syndicate, is headed. A diagnosis of sporadic fatal insomnia has earned him early release from prison after serving 19 years for a murder he didn’t commit. Now he has two goals: to make amends to his troubled son, Joey (a colorless Noah Le Gros), and to track down and punish the surviving members of his former crew. The reason for this vendetta is not immediately clear, but that’s par for the course in a movie that leaves a great deal unexplained until the final half-hour. Until then, “A Score to Settle” takes a strange, intermittently violent and digressive trip alongside a dying man of dubious mental clarity — in other words, the kind of role that’s bang in Cage’s wheelhouse. Less comfortable is his director, Shawn Ku (whose last big-screen feature, “Beautiful Boy,” was almost 10 years ago), who struggles to match his star’s surrender to a story that seems to have little idea where it’s going. While Joey inexplicably appears and disappears at random, his increasingly addled father, bedeviled by flashbacks to his younger self (played by Cage’s spitting-image nephew, Bailey Coppola), gets medieval on a succession of former associates. Conversations about baseball bats and the benefits of applying vitamin E to gunshot scars interrupt the action; but not even John Newman’s distressingly awful dialogue can slow Cage’s roll to a histrionic finish. Or a wistful chorus of “I’m always chasing rainbows.” A Score to Settle Not rated. Running time: 1 hour 43 minutes."
125,Dora and the Lost City of Gold,http://www.nytimes.com/2019/08/08/movies/dora-and-the-lost-city-of-gold-review.html,"If you think it’s odd that Nickelodeon’s animated naturalist tyke Dora the Explorer is a teenager in the new live-action adaptation of her exploits, don’t worry, the film does, too. The most charming moments of “Dora and the Lost City of Gold” come in its first half, as the 16-year-old title character (Isabela Moner), forced to live with relatives while her parents are off on a dangerous new adventure, tries to adapt to life in the suburbs and at high school. There, her unique background, relentless cheer and wide-eyed inquisitiveness prompt strange looks, as she sets off metal detectors with the heavy-duty contents of her jungle survival kit, congratulates the cafeteria staff on a fine lunch, and grills a girl trying to “save the rain forest” about which rain forests, exactly, she’s trying to save. For the school’s winter dance, students are encouraged to go as their favorite star; while everyone else comes dressed as soccer players, pop singers and movie actors, Dora naturally arrives as the sun and proceeds to do an adorably goofy dance. Even her cousin, onetime fellow explorer Diego (Jeff Wahlberg), turns on her at this point. A cruel nickname emerges among the kids: Dorka. “Dora and the Lost City of Gold” is not a satire, however, nor is it an attempt to crossbreed Nickelodeon’s popular bilingual character, who made her first TV appearance in 2000, with “Mean Girls.” Even as it strikes a gently irreverent tone, the film also embodies its heroine’s positive energy: We understand that the world would be a better place if the rest of us were more like Dora, not the other way around. She soon gets a chance to prove her mettle when she and three fellow students are abducted by treasure hunters trying to track down Dora’s parents (Michael Peña and Eva Longoria), who are searching for a lost Incan city of gold named Parapata. The Indiana Jones-style high jinks that ensue don’t quite have the visual verve or breakneck pacing of a “Raiders of the Lost Ark,” or even a “National Treasure,” but they’re invigorated by the film’s cheekiness. Dora has to help a clueless classmate dig a “poo hole” in the jungle. Later, the kids are intoxicated by giant spores and hallucinate that they’ve become animated versions of themselves. There are jokes about neurotoxicity and dysentery. Somehow, it all works. That’s because the film’s freewheeling, what-if quality never becomes meanspirited or gross. The director James Bobin (who achieved a similarly good-natured silliness with his 2011 reboot of “The Muppets”) has a casual style that serves the material well: Nothing is ever too urgent or too lackadaisical. This is a deceptively tough balancing act. Get too loose and the movie will turn into a bunch of limp comedy sketches; get too realistic, and it will lose any sense of what makes Dora such a beloved and timeless character. Like a child unwittingly navigating a jungle full of booby traps and deadly creatures, the film walks a treacherously fine line without ever seeming to break a sweat. Dora and the Lost City of GoldRated PG for mild jungle action and a cavalier attitude toward inflammatory bowel diseases. Running time: 1 hour 42 minutes. "
126,The Kitchen,http://www.nytimes.com/2019/08/07/movies/review-the-kitchen.html,"An offense against feminism, narrative logic and Fleetwood Mac, “The Kitchen” is a terrible, witless mess. Set in New York in the late 1970s, it spins a pandering story about three wallflower wives — played by Melissa McCarthy, Tiffany Haddish and Elisabeth Moss — who transform into crime bosses after their gangster husbands are sent up the river. The laughable setup becomes progressively worse the more the movie tries to spin their metamorphosis as female empowerment, a road to liberation that’s blithely paved with wads of cash, hollow laughs and corpses. McCarthy plays Kathy, the wife of a low-level member of an Irish-American gang that controls Hell’s Kitchen, back in the not remotely good old days before gentrification. The movie’s sentimental favorite, Kathy has worried eyes, two kids and a dumb-cluck husband who, soon after the story begins, botches a holdup with two thug confederates. Left without their family paychecks, Kathy and the other men’s wives, Ruby (Haddish) and Claire (Moss), turn to crime to make ends meet. At first, they timidly shake down grateful businesses for protection money, but soon are making deals with the Italian mob and overseeing a psycho butchering a body.  The whole thing is as absurd as it is dubiously aspirational, and proves a bad fit for the writer-director Andrea Berloff. The Westies, the model for the gang, were a notoriously brutal bunch that had a thing for chopping up their victims; here, they’re mostly bad husbands, inept criminals, routine creeps. (The movie was adapted from a graphic novel.) The three women turn out to be more capable mobsters. Even so, when it comes to violence, they hand off some of their uglier business to a crazed associate (a persuasively dead-eyed Domhnall Gleeson), a move that — as with a discreet bathtub dismemberment — attenuates the horror of their violence and their complicity. There’s so much that’s wrong here, including a lot of the music (Fleetwood Mac!); the confused tones; the disjointed, presumably triage editing; the carefully littered mean streets; the nods to women’s lib. But the biggest problem is that Berloff won’t commit to the villainy — the greed and bloodletting — of her main characters. It’s amusing, at first, to see how they take to crime after their husbands are out of the picture, partly because the leads are appealing and Berloff gives each time to do her thing. Moss, an ace weeper, cries a few rivers. McCarthy bares some soul. Haddish eases into affecting stillness. (Bill Camp, as a silky Mafioso, slinks off with his scenes.) Yet the more successful the women become — the more corrupt and flagrantly cruel — the more Berloff tries to rationalize their actions on feminist grounds, which she does by overloading the movie with stereotyped victimization and flag-waving. All three have been oppressed in some way. Kathy has long been a dutiful wife and daughter. Ruby implausibly married into a bullying, racist family. And Claire, who’s first seen with blood streaking her face, has lived with her abuser for years. The three break out of their birdcages energetically and with fantastical ease, finding themselves through the rapacious exploitation of other people. They lean in with a vengeance. If the women did so unapologetically, staying true to the corrupt course that they set for themselves, “The Kitchen” might have worked, maybe, or at least not felt like such a cop-out. For all their gory deeds and tough words, though, Kathy and her pals are never allowed to be sincerely and thoroughly bad — and as richly complex and contradictory and human — as any memorable male gangster or one of the more righteous heroines from the Roger Corman exploitation-cinema catalog. Instead, like many ill-behaved Hollywood characters, the women of “The Kitchen” pay a price for their criminality, but with a contemporary twist: They are punished with virtue. The Kitchen Rated R for gun and knife violence. Running time: 1 hour 42 minutes."
127,The Art of Racing in the Rain,http://www.nytimes.com/2019/08/08/movies/the-art-of-racing-in-the-rain-review.html,"At first glance, the feeble tear-jerker “The Art of Racing in the Rain” seems to be a movie made for dog lovers. It is told from the perspective of a dog, a beautiful if inexpressive golden retriever named Enzo. But in a twist that undermines the simple-minded sweetness that makes dogs (and dog movies) so appealing, Enzo is not like other pups. He thinks like a person — pondering subjects like death and reincarnation — and he also dreams of being human. The movie begins when Enzo is already long in the tooth and speaking with the gravelly monotone of Kevin Costner. Narrating his life story in retrospect, Enzo recalls being adopted as a puppy by a racecar driver named Denny (Milo Ventimiglia). As Denny’s companion, Enzo has borne loyal witness to his master’s life, and the film observes Denny through Enzo’s adoring eyes. Enzo is by Denny’s side as he falls in love and marries a kindly teacher, Eve (Amanda Seyfried), and he is steadfast when Denny’s domestic bliss is tested by illness and in-laws. Through it all, Enzo longs to guide Denny with words as humans do. Although Enzo claims to hold people in high regard, there’s no one in Denny’s life he deems a more worthy counselor than himself. It’s this moral superiority obtained from two feet above the ground that makes Enzo — and the film that indulges this conceit — so intolerable. He’s a scold, a snob and a suck-up all at once. Yet the treacly script valorizes Enzo, and the director, Simon Curtis, submits to it, trusting that the audience will want to see man’s best friend presented in such an earnest fashion. But Enzo is a bad dog, and his antics play worse for the film’s lack of discipline. The Art of Racing in the Rain Rated PG for bathroom humor and references to cancer. Running time: 1 hour 49 minutes. "
128,Scary Stories to Tell in the Dark,http://www.nytimes.com/2019/08/08/movies/scary-stories-to-tell-in-the-dark-review.html,"If Alvin Schwartz’s popular “Scary Stories” children’s books condensed folklore into an accessible anthology form, “Scary Stories to Tell in the Dark,” an agreeable bit of fan service, performs a similar gateway function for movies. Whether it’s the scene-setting blast of Donovan (“Zodiac”), the low-height Steadicam work (“The Shining”), the red-suffused hallways (David Lynch) or “Night of the Living Dead” playing at a drive-in, the movie takes from the best. [Read how “Scary Stories” gave a future horror author nightmares.] The nostalgia is presumably the signature of Guillermo del Toro, who produced it. Like “The Shape of Water,” which he directed (André Ovredal did that job here), “Scary Stories” spikes its tributes with social commentary. The movie is set in 1968, more than a decade before the first book was published. The ghosts of Vietnam haunt the periphery, and Nixon’s election coincides with a gangly goblin’s arrival. Schwartz’s tales have been woven into a cohesive narrative (and there are nods to others that haven’t been filmed) with a simple device. The main characters — an aspiring writer, Stella (Zoe Colletti); her sidekicks (Gabriel Rush and Austin Zajur); and a newcomer to their small town (Michael Garza) — snatch a book from a haunted house. The tome once belonged to a pariah kept prisoner by her family. Ovredal respects the original illustrations of Stephen Gammell, whose hand is visible in the grotesquely contorted expressions of a scarecrow and in a trollish woman with a face like papier-mâché. (The closing credits list a collection of sculptors and modelers.) Ovredal pays less heed to an unofficial corollary to the Chekhov’s gun rule: If a spider has laid eggs in a girl’s cheek, and the girl is in a school production of “Bye Bye Birdie,” that boil needs to pop during a musical number. Scary Stories to Tell in the Dark Rated PG-13 for creepy crawlies. Running time: 1 hour 51 minutes. "
129,The Peanut Butter Falcon,http://www.nytimes.com/2019/08/08/movies/the-peanut-butter-falcon-review.html,"This movie is rife with name actors: Dakota Johnson, Bruce Dern, John Hawkes, Shia LaBeouf, Thomas Haden Church. But its writer-directors, Tyler Nilson and Michael Schwartz, conceived and executed it as a vehicle for a performer making his debut as a lead actor. Zack Gottsagen plays Zak, a young man with no family who lives in an old-age home in North Carolina. Zak has Down syndrome, and while the state has deemed that he needs constant care, there’s no appropriately specialized facility available to him. So he stays with some feisty seniors, several of whom he’s befriended. Those pals help him plan escapes, most of which fail. But one finally succeeds, and off Zak goes, wearing nothing but white briefs. He’s in search of a wrestling school run by a figure known as the Salt Water Redneck. Zak’s main caretaker, a volunteer named Eleanor (Johnson), is understandably appalled by this development. Zak’s subsequent adventure is a picaresque-humanist one, filled with relatively commonplace plot turns. He hides out in a boat owned by Tyler (LaBeouf), a hard-up fisherman still mourning the death of his older brother (Jon Bernthal in flashbacks) and making trouble with the local crab men, who will soon seek violent payback. Will Tyler find a new brother in Zak? Will Zak finally get into the ring, care of the Salt Water Redneck, and introduce his own wrestling persona, the Peanut Butter Falcon? (There are cameos from real-life wrestlers Mick Foley and Jake Roberts, albeit in mufti.). The clichés in this movie are enacted in a good cause. Gottsagen, who is in his early 30s, has Down syndrome himself and the filmmakers crafted “The Peanut Butter Falcon” specifically for him. Zak takes frequent pratfalls and is often seen in various un-self-conscious states of undress, but the movie never makes him a figure of fun. Neither, by the same token, does it try to wrench sentimental tears out of his condition. They make his character a little guy with a big heart, and big dreams — you’ve heard of such figures, I suppose — and let him have his hero’s journey. Which is, yes, predictable. But I suspect almost nobody who sees “The Peanut Butter Falcon” will mind much. Along with the cinematographer, Nigel Bluck, and the editors, Kevin Tent and Nathaniel Fuller, the directors achieve a relaxed and amiable vibe while moving the story forward with dispatch through picturesque Southern Atlantic land and seascapes.  And Gottsagen is a disarming performer who creates a sweet and funny character. As storytellers, Nilson and Schwartz are careful to cover their bases — an early reference to Eleanor being a woman of independent means helps the film’s finale go down easier, plausibility-wise — but the center of their film is completely without contrivance. The Peanut Butter Falcon Rated PG-13 for pratfalls, shenanigans, language. Running time: 1 hour 33 minutes."
130,After the Wedding,http://www.nytimes.com/2019/08/08/movies/after-the-wedding-review.html,"A supreme example of classed-up mediocrity, “After the Wedding,” a pointless remake of Susanne Bier’s 2007 melodrama of the same name, offers little that’s new and a lot that’s predictable, even to first-time viewers. What has changed in the intervening years is us: The economic and political environment into which this new version drops might cause us to view its plot through more cynical eyes. To no obvious benefit — and some logical detriment — the genders of the central characters have been flipped. The film’s emotional tone is also cooler and more restrained, as if tainted by the brittle self-interest of its most vivid character, Theresa (Julianne Moore). The owner of a thriving media company, Theresa occupies a luxurious Long Island estate where her dreamy husband, Oscar (Billy Crudup), is planning an exhibition of his sculptures. By contrast, the saintly Isabel (Michelle Williams) spends her days serenely meditating in an Indian slum and tending a teeming orphanage. When Theresa summons her to New York, dangling a possible multimillion-dollar donation to the orphanage, Isabel is peeved to learn she must also attend the wedding of Theresa’s daughter, Grace (a very sweet Abby Quinn). A dowdy duckling among swans, Isabel would much rather take the money and run. Written and directed by Moore’s husband, Bart Freundlich, “After the Wedding” buffs poverty and philanthropy to the same high gloss as Theresa’s furniture. As wedding-reception revelations and plot twists pile up, Freundlich, as if fearing to revel in the soapiness of his setup, repeatedly tamps down the conflict. As a result, what should be a volcano of betrayal and acrimony never fully erupts; even Moore’s brief meltdown feels staged, and Isabel is so irritatingly tranquil that Williams has no room to breathe in the role. In place of satisfying spectacle, then, we get a movie pocked with sappy symbolism and facile foreshadowing — like Moore’s fixation on the abandoned eggs in a dried-up bird’s nest. The original “Wedding” was a more unruly affair; this one is creamy and languid, with Julio Macat’s camera soaring high above foreign trees and kissing glowing, caramel skins. Accompanied by Mychael Danna’s moony score, the movie juxtaposes rich and poor, selfish and selfless, motherhood and its substitute. But its characterizations are hollow and its ethics questionable, the cruel manipulation of Isabel softened and, ultimately, forgiven. More than anything, though, “After the Wedding” is a movie that openly admires the casual ability of the rich to purchase whatever they want. Including the remnants of other people’s dreams. After the Wedding Rated PG-13 for a discordantly vulgar outburst and a tragic event. Running time: 1 hour 30 minutes. "
